BrandID,PhotoID,PostURL,PhotoURL,PostDate,PostTime,DownloadDate,Type,Like,LikeAlbum,Comments,Comments_album,NumHashtags,Content,ContentWithoutLink,,1SNS,2brand,3model,31number,32face,33body,34modelposition,4background,5text,51words,52,53textposition,54promotingmessa,6brandname,61brandexpose,62,63brandposition,64brandvisib,65partofprod,66whproduct,7logo,71logoexposure,72,73logoposition,74logotype,75logovisib,76logopartofprod,8product,81productexpose,82,83productposition,9,10angle,11,12hashtag,12_1number,12_2_1content,12_2_2,12_2_3,12_2_4,12_2_5,12_2_6,13text,ContentWithoutLink2,13_2promo,13_3link
8,63,https://www.instagram.com/p/BdPmJheHSMg/?taken-by=gucci,https://scontent-icn1-1.cdninstagram.com/vp/e350597f723aeab68d02846389a97d62/5AEBA387/t51.2885-15/e35/25038578_522982038080187_726188294404046848_n.jpg,2017-12-28T11:08:38,11:08:38,42:10.6,photo,131261,,,,4,"Artist @ignasimonreal imagines a #Gucci festive tree made of a leather belt bag and wallets featuring the House’s vintage logo, part of the #GucciGift selection by #AlessandroMichele. Discover more through link in bio. #GucciCruise18","Artist @ignasimonreal imagines a #Gucci festive tree made of a leather belt bag and wallets featuring the House’s vintage logo, part of the #GucciGift selection by #AlessandroMichele. Discover more through link in bio. #GucciCruise19",,2,8,2,,,,,3,2,,,,,1,1,,"5,8",2,1,5,1,1,,"5,8",3,2,1,1,1,,"5,6,8",,3,,1,4,1,1,1,0,0,1,1,"Artist @ignasimonreal imagines a #Gucci festive tree made of a leather belt bag and wallets featuring the House’s vintage logo, part of the #GucciGift selection by #AlessandroMichele. Discover more through link in bio. #GucciCruise19",1,2
8,64,https://www.instagram.com/p/BdNikhxnWnA/?taken-by=gucci,https://scontent-icn1-1.cdninstagram.com/vp/91d7fc0de138766b7b97e7f855218578/5AF7F6AF/t51.2885-15/e35/25022939_952212674948324_4670798228847853568_n.jpg,2017-12-27T15:58:53,15:58:53,42:11.7,photo,108491,,,,4,"Popping out of a closet, a #GucciTotem top handle bag featuring a metal butterfly closure with crystals from #GucciCruise18 by #AlessandroMichele. Illustration by @ignasimonreal. Discover more through link in bio. #GucciGift","Popping out of a closet, a #GucciTotem top handle bag featuring a metal butterfly closure with crystals from #GucciCruise18 by #AlessandroMichele. Illustration by @ignasimonreal. Discover more through link in bio. #GucciGift",,2,8,1,1,2,2,5,2,2,,,,,2,,,,,,,1,1,,5,1,1,1,1,1,,"5,8",,3,,1,4,0,2,1,0,0,1,1,"Popping out of a closet, a #GucciTotem top handle bag featuring a metal butterfly closure with crystals from #GucciCruise18 by #AlessandroMichele. Illustration by @ignasimonreal. Discover more through link in bio. #GucciGift",1,2
8,65,https://www.instagram.com/p/BdNQrCOHdQN/?taken-by=gucci,https://scontent-icn1-1.cdninstagram.com/vp/2157083a02775e9e39b70e91bf6f7fcd/5AE19637/t51.2885-15/e35/25022067_1963228460607306_4722107308325208064_n.jpg,2017-12-27T13:22:29,13:22:29,42:12.7,photo,129257,,,,4,"“These are Medusa and Perseus, in my take of the myth she turned him into stone,” says @ignasimonreal about the illustration, part of #GucciGift featuring a #GucciSylvie bag embellished with rays of shimmering crystals. Discover more through link in bio. #GucciCruise18 #AlessandroMichele","“These are Medusa and Perseus, in my take of the myth she turned him into stone,” says @ignasimonreal about the illustration, part of #GucciGift featuring a #GucciSylvie bag embellished with rays of shimmering crystals. Discover more through link in bio. #GucciCruise18 #AlessandroMichele",,2,8,1,1,2,2,"2,3,5,6,8,9",2,2,,,,,2,,,,,,,1,1,,5,1,1,1,1,1,,"2,3,5,6,8,9",,4,,1,4,0,2,1,0,0,1,1,"“These are Medusa and Perseus, in my take of the myth she turned him into stone,” says @ignasimonreal about the illustration, part of #GucciGift featuring a #GucciSylvie bag embellished with rays of shimmering crystals. Discover more through link in bio. #GucciCruise18 #AlessandroMichele",1,2
8,66,https://www.instagram.com/p/BdM8dp0nUVX/?taken-by=gucci,https://scontent-icn1-1.cdninstagram.com/vp/c3311f4b31701a6b7ad53707598f92d9/5AF6C669/t51.2885-15/e35/25036666_164637517484010_7574947108860461056_n.jpg,2017-12-27T10:25:54,10:25:54,42:13.9,photo,167194,,,,4,"In an artwork by @ignasimonreal for the #GucciGift campaign, the #GucciSylvie bag designed by #AlessandroMichele featuring the House Web stripe and gold-toned hardware. Discover more through link in bio. #GucciCruise18","In an artwork by @ignasimonreal for the #GucciGift campaign, the #GucciSylvie bag designed by #AlessandroMichele featuring the House Web stripe and gold-toned hardware. Discover more through link in bio. #GucciCruise19",,2,8,1,1,2,2,"1,2,4,5,7,8",3,2,,,,,2,,,,,,,1,1,,"2,3,5,6",1,2,1,1,1,,"1,2,3,4,5,6,7,8,9",,3,,1,4,0,2,1,0,0,1,1,"In an artwork by @ignasimonreal for the #GucciGift campaign, the #GucciSylvie bag designed by #AlessandroMichele featuring the House Web stripe and gold-toned hardware. Discover more through link in bio. #GucciCruise19",1,2
8,67,https://www.instagram.com/p/BdLJPkLnXBQ/?taken-by=gucci,https://scontent-icn1-1.cdninstagram.com/vp/3a04117220c1dea73d0676576a3ceab5/5AE16D40/t51.2885-15/e35/16465308_1561598563929787_4278757732942610432_n.jpg,2017-12-26T17:39:05,17:39:05,42:14.9,photo,104597,,,,2,"In a colorful look from #GucciCruise18 with plush Horsebit slippers, an eccentric woman and her dog, created by @ignasimonreal. #AlessandroMichele Discover more through link in bio.","In a colorful look from #GucciCruise18 with plush Horsebit slippers, an eccentric woman and her dog, created by @ignasimonreal. #AlessandroMichele Discover more through link in bio.",,2,8,1,1,1,1,"2,5,8",1,2,,,,,2,,,,,,,2,,,,,,,1,1,,"5,8",,3,,1,2,0,0,1,0,0,1,1,"In a colorful look from #GucciCruise18 with plush Horsebit slippers, an eccentric woman and her dog, created by @ignasimonreal. #AlessandroMichele Discover more through link in bio.",1,2
8,68,https://www.instagram.com/p/BdKpfNlHVsk/?taken-by=gucci,https://scontent-icn1-1.cdninstagram.com/vp/45f43c09db407c3d41704e5b68077630/5AF97B54/t51.2885-15/e35/25022746_315229255649284_6789068862215159808_n.jpg,2017-12-26T13:01:36,13:01:36,42:16.1,photo,145883,,,,2,"Illustrated packaging for #GucciGift, depicted by @ignasimonreal on a plinth in an antique archway. #AlessandroMichele Discover more through link in bio.","Illustrated packaging for #GucciGift, depicted by @ignasimonreal on a plinth in an antique archway. #AlessandroMichele Discover more through link in bio.",,2,8,2,,,,,1,2,,,,,1,1,,"5,8",1,1,5,1,1,,"5,8",2,1,1,1,1,,"4,5,7,8,9",,3,,1,2,0,1,0,0,0,1,1,"Illustrated packaging for #GucciGift, depicted by @ignasimonreal on a plinth in an antique archway. #AlessandroMichele Discover more through link in bio.",1,2
8,69,https://www.instagram.com/p/BdIJoXNHgMt/?taken-by=gucci,https://scontent-icn1-1.cdninstagram.com/vp/da9a2518eef5b4e02ad3175534604105/5AF01AC2/t51.2885-15/e35/25023062_138756990155394_3071962623885967360_n.jpg,2017-12-25T13:44:45,13:44:45,42:17.1,photo,107843,,,,4,"An imagined Olympian competitor holding a javelin, @ignasimonreal illustrated her in a look from #GucciCruise18 with a bow trimmed dress and a pair of #GucciPrincetown slippers. #GucciGift #AlessandroMichele Discover more through link in bio.","An imagined Olympian competitor holding a javelin, @ignasimonreal illustrated her in a look from #GucciCruise18 with a bow trimmed dress and a pair of #GucciPrincetown slippers. #GucciGift #AlessandroMichele Discover more through link in bio.",,2,8,1,1,1,1,"2,5,7,8",1,2,,,,,2,,,,,,,2,,,,,,,1,1,,"5,8",,3,,1,4,0,2,1,0,0,1,1,"An imagined Olympian competitor holding a javelin, @ignasimonreal illustrated her in a look from #GucciCruise18 with a bow trimmed dress and a pair of #GucciPrincetown slippers. #GucciGift #AlessandroMichele Discover more through link in bio.",1,2
8,70,https://www.instagram.com/p/BdGG5xLH63p/?taken-by=gucci,https://scontent-icn1-1.cdninstagram.com/vp/37078898eac26dc29c569c6509053fab/5ADE96D5/t51.2885-15/e35/24845082_1682135168473659_1535907676876177408_n.jpg,2017-12-24T18:42:26,18:42:26,42:18.3,photo,157440,,,,1,"3/3 ? Seen pulling the sun on his chariot, the Greek god of light and truth Apollo by @ignasimonreal for #GucciGift","3/3 ? Seen pulling the sun on his chariot, the Greek god of light and truth Apollo by @ignasimonreal for #GucciGift",,2,8,1,1,2,1,2,3,2,,,,,2,,,,,,,2,,,,,,,2,,,,,4,,1,1,0,1,0,0,0,0,1,"3/3 ? Seen pulling the sun on his chariot, the Greek god of light and truth Apollo by @ignasimonreal for #GucciGift",2,2
8,71,https://www.instagram.com/p/BdFwlimn3sV/?taken-by=gucci,https://scontent-icn1-1.cdninstagram.com/vp/0e5d9d00d89b6f5854a62e8e8881a84a/5A6027E6/t51.2885-15/e15/25011993_720703114790603_5591220483568697344_n.jpg,2017-12-24T15:27:50,15:27:50,42:19.3,동영상,103940,,,,1,2/3 ? Best wishes from Gucci for the season. An artwork by @ignasimonreal featuring Apollo and his chariot. #GucciGift,2/3 ? Best wishes from Gucci for the season. An artwork by @ignasimonreal featuring Apollo and his chariot. #GucciGift,,2,8,2,,,,,3,1,2,,"7,8,9",2,1,1,,"4,5,6",2,2,,1,1,,"4,5,6",2,2,2,2,,,,,4,,1,1,0,1,0,0,0,0,1,2/3 ? Best wishes from Gucci for the season. An artwork by @ignasimonreal featuring Apollo and his chariot. #GucciGift,2,2
8,72,https://www.instagram.com/p/BdFkFoTnc8L/?taken-by=gucci,https://scontent-icn1-1.cdninstagram.com/vp/ee6b301dd3757ae1fd874baa8e0b4826/5AF3998A/t51.2885-15/e35/25016878_1635554686504177_7807313158925713408_n.jpg,2017-12-24T13:38:13,13:38:13,42:20.4,photo,111436,,,,1,"1/3 ? Apollo, the Greek god of music, truth and prophecy, flying through the skies, as imagined by artist @ignasimonreal for #GucciGift.","1/3 ? Apollo, the Greek god of music, truth and prophecy, flying through the skies, as imagined by artist @ignasimonreal for #GucciGift.",,2,8,2,,,,,3,2,,,,,2,,,,,,,2,,,,,,,2,,,,,4,,1,1,0,1,0,0,0,0,1,"1/3 ? Apollo, the Greek god of music, truth and prophecy, flying through the skies, as imagined by artist @ignasimonreal for #GucciGift.",2,2
8,73,https://www.instagram.com/p/BdDpydlnQT3/?taken-by=gucci,https://scontent-icn1-1.cdninstagram.com/vp/26417e8ae7014278741b1c155377af94/5AFA96E8/t51.2885-15/e35/25010784_1204241699709695_5331634459789754368_n.jpg,2017-12-23T19:49:33,19:49:33,42:21.6,photo,141351,,,,3,"New Year’s messages appear on a phone screen of wallets printed with the vintage Gucci logo, sent by @ignasimonreal for #GucciGift. #AlessandroMichele #GucciCruise18 Discover more through link in bio.","New Year’s messages appear on a phone screen of wallets printed with the vintage Gucci logo, sent by @ignasimonreal for #GucciGift. #AlessandroMichele #GucciCruise18 Discover more through link in bio.",,2,8,2,,,,,1,2,,,,,1,1,,"4,5,7,8",2,1,10,1,1,,"4,5,7,8",3,2,1,1,1,,"4,5,7,8",,3,,1,3,0,1,1,0,0,1,1,"New Year’s messages appear on a phone screen of wallets printed with the vintage Gucci logo, sent by @ignasimonreal for #GucciGift. #AlessandroMichele #GucciCruise18 Discover more through link in bio.",1,2
8,74,https://www.instagram.com/p/BdDQTh2HG9H/?taken-by=gucci,https://scontent-icn1-1.cdninstagram.com/vp/9379041a69eba7d524efa03a0169b528/5AFEA615/t51.2885-15/e35/24845263_1602673076438851_6366164572407070720_n.jpg,2017-12-23T16:06:52,16:06:52,42:22.8,photo,109960,,,,3,Files on a desktop imagined as leather pouches printed with the vintage Gucci logo by @ignasimonreal for #GucciGift. #AlessandroMichele #GucciCruise18 Discover more through link in bio.,Files on a desktop imagined as leather pouches printed with the vintage Gucci logo by @ignasimonreal for #GucciGift. #AlessandroMichele #GucciCruise18 Discover more through link in bio.,,2,8,2,,,,,3,2,,,,,1,1,,"1,2,3,4,5",2,1,5,1,1,,"1,2,3,4,5,6,7",3,2,1,1,1,,"1,2,3,4,5",,3,,1,3,0,1,1,0,0,1,1,Files on a desktop imagined as leather pouches printed with the vintage Gucci logo by @ignasimonreal for #GucciGift. #AlessandroMichele #GucciCruise18 Discover more through link in bio.,1,2
8,75,https://www.instagram.com/p/BdC3gRPnNIp/?taken-by=gucci,https://scontent-icn1-1.cdninstagram.com/vp/16a027778c6b190fafcdbb6302e94cf1/5AF0383D/t51.2885-15/e35/25024490_1964097827185933_2935568339604340736_n.jpg,2017-12-23T12:30:10,12:30:10,42:24.2,photo,166840,,,,2,"A cupid and ‘Soave Amore’ a phrase from a first-century BC poem by Roman poet and philosopher Lucretius ‘On the Nature of Things’, explaining Epicurean philosophy. Illustrated together with wallets featuring the Gucci vintage logo, by @ignasimonreal. #AlessandroMichele #GucciCruise18 Discover more through link in bio.","A cupid and ‘Soave Amore’ a phrase from a first-century BC poem by Roman poet and philosopher Lucretius ‘On the Nature of Things’, explaining Epicurean philosophy. Illustrated together with wallets featuring the Gucci vintage logo, by @ignasimonreal. #AlessandroMichele #GucciCruise18 Discover more through link in bio.",,2,8,1,1,2,2,2,1,2,,,,,1,1,,5,2,1,5,1,1,,5,3,2,1,1,1,,"2,3,4,5,6,7,8,9",,3,,1,2,0,0,1,0,0,1,1,"A cupid and ‘Soave Amore’ a phrase from a first-century BC poem by Roman poet and philosopher Lucretius ‘On the Nature of Things’, explaining Epicurean philosophy. Illustrated together with wallets featuring the Gucci vintage logo, by @ignasimonreal. #AlessandroMichele #GucciCruise18 Discover more through link in bio.",1,2
8,76,https://www.instagram.com/p/BdBBMH3Hg8N/?taken-by=gucci,https://scontent-icn1-1.cdninstagram.com/vp/862b9652c74d1437d86ac4016c68bb35/5AF33CB2/t51.2885-15/e35/25013210_1612482072131425_2901358405400657920_n.jpg,2017-12-22T19:16:19,19:16:19,42:25.2,photo,116615,,,,3,"Apollo’s antique bronzed head is illustrated by @ignasimonreal with a silk tie featuring a jacquard golden bee, part of #GucciGift. #AlessandroMichele #GucciCruise18 Discover more through link in bio.","Apollo’s antique bronzed head is illustrated by @ignasimonreal with a silk tie featuring a jacquard golden bee, part of #GucciGift. #AlessandroMichele #GucciCruise18 Discover more through link in bio.",,2,8,1,1,1,2,"2,3,4,5,6,8",1,2,,,,,2,,,,,,,2,,,,,,,1,2,,"5,8",,3,,1,3,0,1,1,0,0,1,1,"Apollo’s antique bronzed head is illustrated by @ignasimonreal with a silk tie featuring a jacquard golden bee, part of #GucciGift. #AlessandroMichele #GucciCruise18 Discover more through link in bio.",1,2
8,77,https://www.instagram.com/p/BdAmUMrH_sK/?taken-by=gucci,https://scontent-icn1-1.cdninstagram.com/vp/8f8ad993826cbd25a4ccdf6971c5aafb/5AEE90E2/t51.2885-15/e35/25014636_140400613343488_4117124335339044864_n.jpg,2017-12-22T15:21:29,15:21:29,42:27.5,photo,95911,,,,3,"Janus, the Roman god of beginnings, passages, doorways, and endings illustrated by @ignasimonreal with two faces, looking to the future and to the past, a calendar for January 2018 and a striped wool scarf embroidered with a bee. #GucciGift #AlessandroMichele #GucciCruise18 Discover more through link in bio.","Janus, the Roman god of beginnings, passages, doorways, and endings illustrated by @ignasimonreal with two faces, looking to the future and to the past, a calendar for January 2018 and a striped wool scarf embroidered with a bee. #GucciGift #AlessandroMichele #GucciCruise18 Discover more through link in bio.",,2,8,1,1,1,2,"1,2,4,5,6,8,9",1,2,,,,,2,,,,,,,2,,,,,,,1,1,,"4,5,6,7,8,9",,3,,1,3,0,1,1,0,0,1,1,"Janus, the Roman god of beginnings, passages, doorways, and endings illustrated by @ignasimonreal with two faces, looking to the future and to the past, a calendar for January 2018 and a striped wool scarf embroidered with a bee. #GucciGift #AlessandroMichele #GucciCruise18 Discover more through link in bio.",1,2
8,78,https://www.instagram.com/p/BdAMHqZny-2/?taken-by=gucci,https://scontent-icn1-1.cdninstagram.com/vp/6cf8944acffafb4f152a612bb5f474ca/5AEA034D/t51.2885-15/e35/25011955_502841696769640_6555302803135266816_n.jpg,2017-12-22T11:32:35,11:32:35,42:28.5,photo,101969,,,,3,"Cast in bronze, Poseidon’s face by @ignasimonreal and a jacquard bees silk tie from #GucciGift. #AlessandroMichele #GucciCruise18 Discover more through link in bio.","Cast in bronze, Poseidon’s face by @ignasimonreal and a jacquard bees silk tie from #GucciGift. #AlessandroMichele #GucciCruise18 Discover more through link in bio.",,2,8,1,1,1,2,"2,3,5,6,8",1,2,,,,,2,,,,,,,2,,,,,,,1,2,,"5,8",,3,,1,3,0,1,1,0,0,1,1,"Cast in bronze, Poseidon’s face by @ignasimonreal and a jacquard bees silk tie from #GucciGift. #AlessandroMichele #GucciCruise18 Discover more through link in bio.",1,2
8,79,https://www.instagram.com/p/Bc-mpnlnESQ/?taken-by=gucci,https://scontent-icn1-1.cdninstagram.com/vp/cbc0c360a09fae306c37d75e3468795a/5AE81726/t51.2885-15/e35/25007198_1330755917036182_9075247247700000768_n.jpg,2017-12-21T20:45:56,20:45:56,42:29.6,photo,150664,,,,3,"A pointy-eared nymph wearing a pair of bow decked sandals from #GucciCruise18, part of the series of artworks from the #GucciGift campaign created by artist @ignasimonreal. Discover more through link in bio. #AlessandroMichele","A pointy-eared nymph wearing a pair of bow decked sandals from #GucciCruise18, part of the series of artworks from the #GucciGift campaign created by artist @ignasimonreal. Discover more through link in bio. #AlessandroMichele",,2,8,1,1,2,1,"1,2,3,4,5,8",2,2,,,,,2,,,,,,,2,,,,,,,1,1,,"1,2,4,5,8",,2,,1,3,0,1,1,0,0,1,1,"A pointy-eared nymph wearing a pair of bow decked sandals from #GucciCruise18, part of the series of artworks from the #GucciGift campaign created by artist @ignasimonreal. Discover more through link in bio. #AlessandroMichele",1,2
8,80,https://www.instagram.com/p/Bc-EJZDnElo/?taken-by=gucci,https://scontent-icn1-1.cdninstagram.com/vp/5c3b6f5156640de607dad597ba8e542d/5AE938E8/t51.2885-15/e35/25036101_137545530220034_7332441182175232000_n.jpg,2017-12-21T15:44:26,15:44:26,42:30.7,photo,117513,,,,3,"In this design of #GucciGift illustrated by @ignasimonreal, the nymph Eurydice, wife of Orpheus who by myth was bitten by a snake and died, wears metallic pumps with mirrored heels and a floral printed dress from #GucciCruise18 by #AlessandroMichele. Discover more through link in bio.","In this design of #GucciGift illustrated by @ignasimonreal, the nymph Eurydice, wife of Orpheus who by myth was bitten by a snake and died, wears metallic pumps with mirrored heels and a floral printed dress from #GucciCruise18 by #AlessandroMichele. Discover more through link in bio.",,2,8,1,1,2,2,"2,3,5,6,8",2,2,,,,,2,,,,,,,2,,,,,,,1,1,,"2,3,5,6,8",,2,,1,3,0,1,1,0,0,1,1,"In this design of #GucciGift illustrated by @ignasimonreal, the nymph Eurydice, wife of Orpheus who by myth was bitten by a snake and died, wears metallic pumps with mirrored heels and a floral printed dress from #GucciCruise18 by #AlessandroMichele. Discover more through link in bio.",1,2
8,81,https://www.instagram.com/p/Bc9oFvpnPlR/?taken-by=gucci,https://scontent-icn1-1.cdninstagram.com/vp/c4e0588f7c9435296668157ab335260e/5AFEFAEE/t51.2885-15/e35/25011999_875805805920392_7654661482830888960_n.jpg,2017-12-21T11:39:16,11:39:16,42:31.7,photo,111874,,,,3,"For the #GucciGift campaign, Spanish artist @ignasimonreal depicts nymphs in glimmering ready-to-wear from the #GucciCruise18 collection by #AlessandroMichele. Discover more through link in bio.","For the #GucciGift campaign, Spanish artist @ignasimonreal depicts nymphs in glimmering ready-to-wear from the #GucciCruise18 collection by #AlessandroMichele. Discover more through link in bio.",,2,8,1,1,1,1,"2,4,5,6,7,8",2,2,,,,,2,,,,,,,2,,,,,,,1,1,,"2,4,5,6,7,8",,3,,1,3,0,1,1,0,0,1,1,"For the #GucciGift campaign, Spanish artist @ignasimonreal depicts nymphs in glimmering ready-to-wear from the #GucciCruise18 collection by #AlessandroMichele. Discover more through link in bio.",1,2
8,82,https://www.instagram.com/p/Bc75teCH1M4/?taken-by=gucci,https://scontent-icn1-1.cdninstagram.com/vp/e16d2005dd15708388b9e58e7e21eddf/5AE95846/t51.2885-15/e35/25015309_198089940768227_8958861966214955008_n.jpg,2017-12-20T19:34:45,19:34:45,42:32.8,photo,230299,,,,5,"Mermaids on a rock wearing the ice skater inspired gowns from the #GucciSS18 collection by #AlessandroMichele. Created by @ignasimonreal, the artwork is part of the #GucciSS18 campaign #GucciHallucination. Creative Director: #AlessandroMichele Art Director: @christophersimmonds","Mermaids on a rock wearing the ice skater inspired gowns from the #GucciSS18 collection by #AlessandroMichele. Created by @ignasimonreal, the artwork is part of the #GucciSS18 campaign #GucciHallucination. Creative Director: #AlessandroMichele Art Director: @christophersimmonds",,2,8,1,2,1,1,"2,3,4,5,6,7,9",3,2,,,,,2,,,,,,,2,,,,,,,1,2,,"3,4,5,6,8,9",,3,,1,5,0,1,2,0,0,2,1,"Mermaids on a rock wearing the ice skater inspired gowns from the #GucciSS18 collection by #AlessandroMichele. Created by @ignasimonreal, the artwork is part of the #GucciSS18 campaign #GucciHallucination. Creative Director: #AlessandroMichele Art Director: @christophersimmonds",2,2
8,83,https://www.instagram.com/p/Bc7sTo1nUgT/?taken-by=gucci,https://scontent-icn1-1.cdninstagram.com/vp/56864bd52bc1126cb56ce071a841bf10/5AD7F955/t51.2885-15/e35/25010717_870103839826050_9071548224296189952_n.jpg,2017-12-20T17:37:38,17:37:38,42:34.0,photo,120922,,,,5,"A tiger-sphinx creature wearing #GucciEyewear observes women dressed in looks by #AlessandroMichele, from the #GucciSS18 campaign by @ignasimonreal. #GucciHallunication Creative Director: #AlessandroMichele Art Director: @christophersimmonds","A tiger-sphinx creature wearing #GucciEyewear observes women dressed in looks by #AlessandroMichele, from the #GucciSS18 campaign by @ignasimonreal. #GucciHallunication Creative Director: #AlessandroMichele Art Director: @christophersimmonds",,2,8,1,2,1,1,"2,3,5,6,8,9",1,2,,,,,2,,,,,,,1,1,,"1,5",1,1,1,1,1,,"1,2,3,5,6,8,9",,3,,1,5,0,2,1,0,0,2,1,"A tiger-sphinx creature wearing #GucciEyewear observes women dressed in looks by #AlessandroMichele, from the #GucciSS18 campaign by @ignasimonreal. #GucciHallunication Creative Director: #AlessandroMichele Art Director: @christophersimmonds",2,2
8,84,https://www.instagram.com/p/Bc7ec_OH7Ip/?taken-by=gucci,https://scontent-icn1-1.cdninstagram.com/vp/34e9c1a38cac26621069a3acd3b31239/5AFE069A/t51.2885-15/e35/25011010_1545383502209389_6853620382428037120_n.jpg,2017-12-20T15:36:34,15:36:34,42:35.1,photo,94062,,,,5,"A gondola steered by a gondolier dressed in a #GucciEltonJohn look inspired by an original @bobmackie bomber from sir @eltonjohn’s archive. Mermaids are in the water, an owl in the air and a man reclines in the plush seat wearing a look by #AlessandroMichele. Designed by the hand of @ignasimonreal, an image from the #GucciSS18 campaign #GucciHallunication. Creative Director: #AlessandroMichele Art Director: @christophersimmonds","A gondola steered by a gondolier dressed in a #GucciEltonJohn look inspired by an original @bobmackie bomber from sir @eltonjohn’s archive. Mermaids are in the water, an owl in the air and a man reclines in the plush seat wearing a look by #AlessandroMichele. Designed by the hand of @ignasimonreal, an image from the #GucciSS18 campaign #GucciHallunication. Creative Director: #AlessandroMichele Art Director: @christophersimmonds",,2,8,1,4,1,1,"1,4,5,7,8",3,2,,,,,2,,,,,,,2,,,,,,,1,1,,"1,4,5,7",,4,,1,5,0,2,1,0,0,2,1,"A gondola steered by a gondolier dressed in a #GucciEltonJohn look inspired by an original @bobmackie bomber from sir @eltonjohn’s archive. Mermaids are in the water, an owl in the air and a man reclines in the plush seat wearing a look by #AlessandroMichele. Designed by the hand of @ignasimonreal, an image from the #GucciSS18 campaign #GucciHallunication. Creative Director: #AlessandroMichele Art Director: @christophersimmonds",2,2
8,85,https://www.instagram.com/p/Bc7Z-sUH84A/?taken-by=gucci,https://scontent-icn1-1.cdninstagram.com/vp/71251cf11755dbe8b34932e8bf167089/5AEB82DB/t51.2885-15/e35/25012015_386863001735259_4536948729868976128_n.jpg,2017-12-20T14:57:29,14:57:29,42:36.2,photo,160551,,,,4,"A knight on horseback carrying a new men’s suede tote with interlocking G, while a castle stands on an island suspended in the air, from the #GucciSS18 campaign illustrated by @ignasimonreal. #AlessandroMichele #GucciHallucination Creative Director: #AlessandroMichele Art Director: @christophersimmonds","A knight on horseback carrying a new men’s suede tote with interlocking G, while a castle stands on an island suspended in the air, from the #GucciSS18 campaign illustrated by @ignasimonreal. #AlessandroMichele #GucciHallucination Creative Director: #AlessandroMichele Art Director: @christophersimmonds",,2,8,1,1,2,1,"2,3,4,5,9",3,2,,,,,2,,,,,,,1,1,,"5,6",1,2,1,1,1,,"2,3,5,6",,3,,1,4,0,1,1,0,0,2,1,"A knight on horseback carrying a new men’s suede tote with interlocking G, while a castle stands on an island suspended in the air, from the #GucciSS18 campaign illustrated by @ignasimonreal. #AlessandroMichele #GucciHallucination Creative Director: #AlessandroMichele Art Director: @christophersimmonds",2,2
