BrandID,PhotoID,PostURL,PhotoURL,PostDate,PostTime,DownloadDate,Type,Like,LikeAlbum,Comments,Comments_album,NumHashtags,Content,ContentWithoutLink,,1SNS,2brand,3model,31number,32face,33body,34modelposition,4background,5text,51words,52,53textposition,54promotingmessa,6brandname,61brandexpose,62,63brandposition,64brandvisib,65partofprod,66whproduct,7logo,71logoexposure,72,73logoposition,74logotype,75logovisib,76logopartofprod,8product,81productexpose,82,83productposition,9,10angle,11,12hashtag,12_1number,12_2_1content,12_2_2,12_2_3,12_2_4,12_2_5,12_2_6,13text,ContentWithoutLink2,13_2promo,13_3link
3,91,https://www.instagram.com/p/Bc_FrnTlBGI/?taken-by=forever21,https://scontent-icn1-1.cdninstagram.com/vp/2d2b225b5447c64432852fd6aa53a5b2/5AF1A669/t51.2885-15/e35/20214487_1186350631509873_8792608493765918720_n.jpg,2017-12-22T01:17:05, 01:17:05,45:47.8,photo,53096,,,,1,Wrap up the #firstdayofwinter with your best furry friend ???? @darlinginthecity (shop link in bio),Wrap up the #firstdayofwinter with your best furry friend ???? @darlinginthecity (shop link in bio),,2,3,1,1,1,1,"2,3,5,6,8,9",2,2,,,,,2,,,,,,,2,,,,,,,1,1,,"2,3,5,6,8,9",,3,,1,1,0,0,1,0,0,0,1,Wrap up the #firstdayofwinter with your best furry friend ???? @darlinginthecity (shop link in bio),1,2
3,92,https://www.instagram.com/p/Bc-sKqfFhl-/?taken-by=forever21,https://scontent-icn1-1.cdninstagram.com/vp/7e7270da71ed352b6d295fef01fa1bac/5A600022/t51.2885-15/e15/25037179_197375247506771_167227824434839552_n.jpg,2017-12-21T21:40:11,21:40:11,45:48.7,동영상,34494,,,,0,Go green for your glam ??? @paudictado ? Take the classic cat eye to a holiday level with a pop of green liner + top it all off with sparkly star glitter roots ???? (shop link in bio),Go green for your glam ??? @paudictado ? Take the classic cat eye to a holiday level with a pop of green liner + top it all off with sparkly star glitter roots ???? (shop link in bio),,2,3,1,1,1,2,"1,2,3,4,5,6,7,8,9",4,2,,,,,2,,,,,,,2,,,,,,,2,,,,,3,,2,,,,,,,,1,Go green for your glam ??? @paudictado ? Take the classic cat eye to a holiday level with a pop of green liner + top it all off with sparkly star glitter roots ???? (shop link in bio),1,2
3,93,https://www.instagram.com/p/Bc-OWTKFVBh/?taken-by=forever21,https://scontent-icn1-1.cdninstagram.com/vp/eb77fc3bb9875247b011df23bef92115/5AE95EAA/t51.2885-15/e35/25011098_292340534621190_2998279749798723584_n.jpg,2017-12-21T17:13:34,17:13:34,45:49.6,photo,95087,,,,0,essential coffee run before a last-minute shopping trip ???? @kerifay (shop link in bio),essential coffee run before a last-minute shopping trip ???? @kerifay (shop link in bio),,2,3,1,1,2,1,"1,2,3,4,5,6,7,8,9",3,2,,,,,2,,,,,,,2,,,,,,,1,1,,"1,2,3,4,5,6,7,8,9",,3,,2,,,,,,,,1,essential coffee run before a last-minute shopping trip ???? @kerifay (shop link in bio),1,2
3,94,https://www.instagram.com/p/Bc81ZemFiQ0/?taken-by=forever21,https://scontent-icn1-1.cdninstagram.com/vp/c8feccc8df9f57ed1015f9f4efd320ef/5AF05D28/t51.2885-15/e35/25012745_382458962180908_2546152751616753664_n.jpg,2017-12-21T04:16:19,4:16:19,45:50.4,photo,67601,,,,0,holidays got us feelin’ some type of way ?? @britandco @sarahliztate,holidays got us feelin’ some type of way ?? @britandco @sarahliztate,,2,3,2,,,,,1,1,4,,"2,4,5,6,7,8,9",2,2,,,,,,,2,,,,,,,2,,,,,3,,2,,,,,,,,1,holidays got us feelin’ some type of way ?? @britandco @sarahliztate,2,2
3,95,https://www.instagram.com/p/Bc8kcJAFMMO/?taken-by=forever21,https://scontent-icn1-1.cdninstagram.com/vp/f589b3d0626918171bdb80195b6b883a/5AE5C2E9/t51.2885-15/e35/25012638_214000349142783_2280680419324067840_n.jpg,2017-12-21T01:48:08,1:48:08,45:51.2,photo,60685,,,,0,Festive florals?? @audriestorme (shop link in bio),Festive florals?? @audriestorme (shop link in bio),,2,3,1,1,2,1,"1,2,3,4,5,6,7,8,9",2,2,,,,,2,,,,,,,2,,,,,,,1,1,,"1,2,3,4,5,6,7,8,9",,3,,2,,,,,,,,1,Festive florals?? @audriestorme (shop link in bio),1,2
3,96,https://www.instagram.com/p/Bc79iDAlyLY/?taken-by=forever21,https://scontent-icn1-1.cdninstagram.com/vp/880321a65418e2a84d4e7f5ec73328a6/5AEC2468/t51.2885-15/e35/25016127_152610662036050_1409719729538465792_n.jpg,2017-12-20T20:08:09,20:08:09,45:52.1,photo,127592,,,,0,these are a few of our favorite things ??? @hungryhipsters (shop link in bio),these are a few of our favorite things ??? @hungryhipsters (shop link in bio),,2,3,2,,,,,1,2,,,,,2,,,,,,,2,,,,,,,1,1,,"1,2,3,4,5,6,7,8,9",,3,,2,,,,,,,,1,these are a few of our favorite things ??? @hungryhipsters (shop link in bio),1,2
3,97,https://www.instagram.com/p/Bc7g2SAFdqV/?taken-by=forever21,https://scontent-icn1-1.cdninstagram.com/vp/5c8ef35dfcc2ae37093e957b3ee11dc9/5AE20073/t51.2885-15/e35/25038302_1761046540869176_3951424149167013888_n.jpg,2017-12-20T15:57:30,15:57:30,45:52.9,photo,69184,,,,0,love is always the answer ?? @joandkemp (shop link in bio),love is always the answer ?? @joandkemp (shop link in bio),,2,3,1,1,2,2,"1,2,3,4,5,6,7,8,9",3,2,,,,,2,,,,,,,2,,,,,,,1,1,,"1,2,3,4,5,6,7,8,9",,3,,2,,,,,,,,1,love is always the answer ?? @joandkemp (shop link in bio),1,2
3,98,https://www.instagram.com/p/Bc6Mrdflf8A/?taken-by=forever21,https://scontent-icn1-1.cdninstagram.com/vp/b6a0812b68c32a5b6adb53af3120e561/5A5FE763/t51.2885-15/e15/25011654_741671409356889_4836287373211860992_n.jpg,2017-12-20T03:43:47,3:43:47,45:53.9,동영상,26243,,,,1,going for the gold ??? @paudictado (shop link in bio) #f21xbeauty,going for the gold ??? @paudictado (shop link in bio) #f21xbeauty,,2,3,1,1,1,2,"1,2,3,4,5,6,7,8,9",1,2,,,,,2,,,,,,,2,,,,,,,1,2,,"4,6,7,8,9",,3,,1,1,0,1,0,0,0,0,1,going for the gold ??? @paudictado (shop link in bio) #f21xbeauty,1,2
3,99,https://www.instagram.com/p/Bc58Lf_lRR-/?taken-by=forever21,https://scontent-icn1-1.cdninstagram.com/vp/78dcf39ce3f9935c8c87f3dbfb58356d/5ADF89B3/t51.2885-15/e35/25010710_2089012521332403_4446166238061658112_n.jpg,2017-12-20T01:17:51,1:17:51,45:55.3,photo,38727,,,,0,Cheers to the perfect party! ????Check out our stories to see @hungryhipsters top party decor picks (shop link in bio),Cheers to the perfect party! ????Check out our stories to see @hungryhipsters top party decor picks (shop link in bio),,2,3,1,2,2,2,"4,5,6,7,9",1,2,,,,,2,,,,,,,2,,,,,,,2,,,,,3,,2,,,,,,,,1,Cheers to the perfect party! ????Check out our stories to see @hungryhipsters top party decor picks (shop link in bio),1,2
3,100,https://www.instagram.com/p/Bc5Y-OSFRGa/?taken-by=forever21,https://scontent-icn1-1.cdninstagram.com/vp/bfd9109eba54a60b163e0cc36c27293a/5AF8E464/t51.2885-15/e35/25037893_215117339032221_3865141030739247104_n.jpg,2017-12-19T20:10:12,20:10:12,45:56.3,photo,67687,,,,0,Snowflakes & stars ??? Which one does not belong? ?? @hedgiegram (shop link in bio),Snowflakes & stars ??? Which one does not belong? ?? @hedgiegram (shop link in bio),,2,3,2,,,,,1,2,,,,,2,,,,,,,2,,,,,,,1,1,,6,,1,,2,,,,,,,,1,Snowflakes & stars ??? Which one does not belong? ?? @hedgiegram (shop link in bio),1,2
4,1,https://www.instagram.com/p/BeBez2on_JZ/?taken-by=adidasoriginals,https://scontent-icn1-1.cdninstagram.com/vp/a2de92d4ddc73884fdca7f397df3e806/5AFA0D3A/t51.2885-15/e35/26269010_399048650539150_5007648356344791040_n.jpg,2018-01-16T20:06:32,20:06:32,42:33.5,photo,171310,,,,1,#EVERYN carries simplistic style in its own way. Available from January 24th.,#EVERYN carries simplistic style in its own way. Available from January 24th.,,2,4,1,1,2,2,"1,2,3,4,5,6,7,8,9",3,2,,,,,1,1,,"7,8",1,1,6,1,1,,"7,8",3,1,1,1,1,,"1,2,3,4,5,6,7,8,9",,3,,1,1,0,1,0,0,0,0,1,#EVERYN carries simplistic style in its own way. Available from January 24th.,1,2
4,2,https://www.instagram.com/p/BeAyedcnqvH/?taken-by=adidasoriginals,https://scontent-icn1-1.cdninstagram.com/vp/eb73ce9f946ba62190bce7ccb2d72508/5AD85DB3/t51.2885-15/e35/26072846_2019066698309483_5980933120084410368_n.jpg,2018-01-16T13:39:08,13:39:08,42:34.6,photo,114978,,,,1,"An understated reimagination of classic design, the #EVERYN encapsulates the forward-thinking style of today. Shop the shoe from January 24th.","An understated reimagination of classic design, the #EVERYN encapsulates the forward-thinking style of today. Shop the shoe from January 24th.",,2,4,1,1,1,1,"2,3,4,5,6,7,8",3,2,,,,,2,,,,,,,2,,,,,,,1,1,,"2,3,4,5,6,7,8",,3,,1,1,0,1,0,0,0,0,1,"An understated reimagination of classic design, the #EVERYN encapsulates the forward-thinking style of today. Shop the shoe from January 24th.",1,2
4,3,https://www.instagram.com/p/BeAbMepHnb7/?taken-by=adidasoriginals,https://scontent-icn1-1.cdninstagram.com/vp/0266cfdfc0553ca11a439afd98d145a5/5AF4EBE1/t51.2885-15/e35/26180343_176763659592588_551082280177631232_n.jpg,2018-01-16T10:15:42,10:15:42,42:35.6,photo,225069,,,,1,"An expression of femininity, #EVERYN arrives in stores January 24th.","An expression of femininity, #EVERYN arrives in stores January 24th.",,2,4,1,1,2,2,"1,2,3,4,5,6,8,9",2,2,,,,,1,1,,5,2,1,6,1,1,,5,3,2,1,1,1,,"1,2,3,4,5,6,8,9",,3,,1,1,0,1,0,0,0,0,1,"An expression of femininity, #EVERYN arrives in stores January 24th.",1,2
4,4,https://www.instagram.com/p/Bd1y-tcHl4I/?taken-by=adidasoriginals,https://scontent-icn1-1.cdninstagram.com/vp/292457320586d28f82d0c1cb9532ed83/5A61370A/t51.2885-15/e15/26351819_295502264305130_7185550925535117312_n.jpg,2018-01-12T07:12:13,7:12:13,42:36.7,동영상,88901,,,,1,We like to keep our head in the clouds with #ADICOLOR blue. Cop yours from January 18th.,We like to keep our head in the clouds with #ADICOLOR blue. Cop yours from January 18th.,,2,4,1,1,1,1,"1,4,5,7,8",2,2,,,,,1,1,,4,2,1,1,1,1,,"4,7",3,2,1,1,1,,"4,5,7,8",,3,,1,1,0,1,0,0,0,0,1,We like to keep our head in the clouds with #ADICOLOR blue. Cop yours from January 18th.,1,2
4,5,https://www.instagram.com/p/Bd0Dz9Gnkz3/?taken-by=adidasoriginals,https://scontent-icn1-1.cdninstagram.com/vp/6755b48bfb3ff0b87303f5f3f1ad2d52/5ADA0901/t51.2885-15/e35/26158979_749292795268981_435698954433200128_n.jpg,2018-01-11T15:00:29,15:00:29,42:37.7,photo,194970,,,,1,"Eat your greens, (wear them too). #ADICOLOR available from January 18th.","Eat your greens, (wear them too). #ADICOLOR available from January 18th.",,2,4,2,,,,,1,2,,,,,1,1,,2,2,1,1,1,1,,2,3,2,1,1,1,,"1,2,3,4,5,6,7,8,9",,3,,1,1,0,1,0,0,0,0,1,"Eat your greens, (wear them too). #ADICOLOR available from January 18th.",1,2
4,6,https://www.instagram.com/p/BdzcWD3nbwI/?taken-by=adidasoriginals,https://scontent-icn1-1.cdninstagram.com/vp/a1ba8c99f61c0f266e9917c68c8cea49/5A614F69/t51.2885-15/e15/26066590_190335321548563_4306433479995817984_n.jpg,2018-01-11T09:15:51,9:15:51,42:38.7,동영상,120318,,,,1,Spice it up. #ADICOLOR red takes to stores and online January 18th.,Spice it up. #ADICOLOR red takes to stores and online January 18th.,,2,4,1,1,1,1,"2,4,5,7,8",2,2,,,,,1,2,,5,2,1,1,1,1,,"5,7,8",3,2,1,1,1,,"4,5,7,8",,3,,1,1,0,1,0,0,0,0,1,Spice it up. #ADICOLOR red takes to stores and online January 18th.,1,2
4,7,https://www.instagram.com/p/Bdx5JQrnvjc/?taken-by=adidasoriginals,https://scontent-icn1-1.cdninstagram.com/vp/c3ffadf5fa6b988290129668e96e46c5/5AEBACF8/t51.2885-15/e35/26156686_2218858298341225_6195835884663734272_n.jpg,2018-01-10T18:48:48,18:48:48,42:40.7,photo,198928,,,,1,"Get your January blues, in all sorts of hues. #ADICOLOR, in stores and online from January 18th.","Get your January blues, in all sorts of hues. #ADICOLOR, in stores and online from January 18th.",,2,4,2,,,,,1,2,,,,,1,1,,"2,5",2,1,1,1,1,,"2,5",3,2,1,1,1,,"1,2,3,4,5,6,7,8,9",,3,,1,1,0,1,0,0,0,0,1,"Get your January blues, in all sorts of hues. #ADICOLOR, in stores and online from January 18th.",1,2
4,8,https://www.instagram.com/p/BdxbXmXnJKc/?taken-by=adidasoriginals,https://scontent-icn1-1.cdninstagram.com/vp/a7f23fb6a499af89791427d37ebb4143/5A61A531/t51.2885-15/e15/26158382_303036373551878_8516455380966965248_n.jpg,2018-01-10T14:28:43,14:28:43,42:41.7,동영상,110474,,,,1,"Keep it green, #ADICOLOR green. Landing January 18th.","Keep it green, #ADICOLOR green. Landing January 18th.",,2,4,1,1,1,1,"1,2,4,5,7,8",1,2,,,,,1,1,,2,1,1,1,1,1,,"2,8",3,2,1,1,1,,"1,2,4,5,7,8",,4,,1,1,0,1,0,0,0,0,1,"Keep it green, #ADICOLOR green. Landing January 18th.",1,2
4,9,https://www.instagram.com/p/Bdw1hfMHV8n/?taken-by=adidasoriginals,https://scontent-icn1-1.cdninstagram.com/vp/6a236c6a24607f52214db7a7e737b776/5AE69E94/t51.2885-15/e35/25038654_2051062175173917_3156069585464066048_n.jpg,2018-01-10T08:57:55,8:57:55,42:42.9,photo,374108,,,,1,"Roses are red, #ADICOLOR is too. Arriving in stores and online January 18th.","Roses are red, #ADICOLOR is too. Arriving in stores and online January 18th.",,2,4,2,,,,,1,2,,,,,1,1,,"2,5",2,1,1,1,1,,"2,5",3,2,1,1,1,,"1,2,3,4,5,6,7,8,9",,3,,1,1,0,1,0,0,0,0,1,"Roses are red, #ADICOLOR is too. Arriving in stores and online January 18th.",1,2
4,10,https://www.instagram.com/p/BdvVM1YnM8w/?taken-by=adidasoriginals,https://scontent-icn1-1.cdninstagram.com/vp/ebabd6acc55d88be263c16e5fd3e6358/5AE790B1/t51.2885-15/e35/26068713_1717763821622814_7312475541368471552_n.jpg,2018-01-09T18:56:14,18:56:14,42:47.7,photo,137215,,,,1,Keep your cool with the @UnitedArrowsandSons Urban jacket and matching #NMD CS2 arriving in stores January 20th. Modeled by @KasperDolberg.,Keep your cool with the @UnitedArrowsandSons Urban jacket and matching #NMD CS2 arriving in stores January 20th. Modeled by @KasperDolberg.,,2,4,1,3,1,1,"1,2,3,4,5,6,7,8,9",4,2,,,,,1,1,,"1,4,6,7",2,1,"1,2,6",1,1,,"1,4,6,7,8",3,2,1,1,1,,"1,2,3,4,5,6,7,8,9",,6,,1,1,0,1,0,0,0,0,1,Keep your cool with the @UnitedArrowsandSons Urban jacket and matching #NMD CS2 arriving in stores January 20th. Modeled by @KasperDolberg.,1,2
4,11,https://www.instagram.com/p/BduzsGYHlSs/?taken-by=adidasoriginals,https://scontent-icn1-1.cdninstagram.com/vp/7754a44dee10f02906d978f9c6ffe0eb/5AED7FA0/t51.2885-15/e35/25039017_666338090422556_9117198173259956224_n.jpg,2018-01-09T14:03:24,14:03:24,42:49.5,photo,106769,,,,0,AFC Ajax’s @KasperDolberg lends his hand to modeling for our latest @UnitedArrowsandSons collection. Featuring apparel and footwear the collaboration is available from January 20th.,AFC Ajax’s @KasperDolberg lends his hand to modeling for our latest @UnitedArrowsandSons collection. Featuring apparel and footwear the collaboration is available from January 20th.,,2,4,1,1,1,1,"1,2,4,5,6,8,9",1,2,,,,,1,1,,4,1,1,2,1,1,,4,3,1,1,1,1,,"1,2,4,5,6,8,9",,1,,2,,,,,,,,1,AFC Ajax’s @KasperDolberg lends his hand to modeling for our latest @UnitedArrowsandSons collection. Featuring apparel and footwear the collaboration is available from January 20th.,1,2
4,12,https://www.instagram.com/p/BduVL92nd5u/?taken-by=adidasoriginals,https://scontent-icn1-1.cdninstagram.com/vp/86b3377849c694ade1e714c4dc1bac35/5AEE1BD4/t51.2885-15/e35/26072382_1616110061802089_6762241418447552512_n.jpg,2018-01-09T09:36:52,9:36:52,42:50.9,photo,161024,,,,0,Japan’s @UnitedArrowsandSons returns for a clean collection celebrating iconic apparel from the adidas archive. Wear yours from January 20th. Modeled by @kasperdolberg,Japan’s @UnitedArrowsandSons returns for a clean collection celebrating iconic apparel from the adidas archive. Wear yours from January 20th. Modeled by @kasperdolberg,,2,4,1,6,1,2,"1,2,3,4,5,6,7,8,9",4,2,,,,,1,1,,1,1,1,1,1,1,,"1,2,5,6,8,9",3,2,1,1,1,,"1,2,3,4,5,6,7,8,9",,6,,2,,,,,,,,1,Japan’s @UnitedArrowsandSons returns for a clean collection celebrating iconic apparel from the adidas archive. Wear yours from January 20th. Modeled by @kasperdolberg,1,2
4,13,https://www.instagram.com/p/BdlA4TDHaIL/?taken-by=adidasoriginals,https://scontent-icn1-1.cdninstagram.com/vp/e2702d952fc05c2fa73e24304f7991d7/5AF6FC85/t51.2885-15/e35/26282551_1953452248254356_4953591511410278400_n.jpg,2018-01-05T18:46:16,18:46:16,42:52.4,photo,193367,,,,2,Two classic silhouettes see traditional renditions. The CNY #SUPERSTAR and #CAMPUS land January 13th.,Two classic silhouettes see traditional renditions. The CNY #SUPERSTAR and #CAMPUS land January 13th.,,2,4,2,,,,,1,2,,,,,1,2,,4,1,1,6,1,2,,"4,5",3,2,1,1,1,,"1,4,5,6,8",,3,,1,2,0,0,0,0,0,1,1,Two classic silhouettes see traditional renditions. The CNY #SUPERSTAR and #CAMPUS land January 13th.,2,2
4,14,https://www.instagram.com/p/BdkgYeFHg1_/?taken-by=adidasoriginals,https://scontent-icn1-1.cdninstagram.com/vp/fd8ecde7433bc945b260e634be6f07c7/5AF0A0BE/t51.2885-15/e35/26318107_1702081379859039_2451611806943150080_n.jpg,2018-01-05T14:02:18,14:02:18,42:53.9,photo,234946,,,,0,Four silhouettes with traditional Chinese blessings embroidered throughout. Cop the CNY pack from January 13th.,Four silhouettes with traditional Chinese blessings embroidered throughout. Cop the CNY pack from January 13th.,,2,4,2,,,,,1,2,,,,,1,1,,"4,6",2,1,6,1,1,,"4,6",3,2,1,1,1,,"1,2,4,5,6,9",,3,,2,,,,,,,,1,Four silhouettes with traditional Chinese blessings embroidered throughout. Cop the CNY pack from January 13th.,1,2
4,15,https://www.instagram.com/p/Bdj-XS-n9VR/?taken-by=adidasoriginals,https://scontent-icn1-1.cdninstagram.com/vp/bcb178493f94f0db59f8022590f762a4/5AE04484/t51.2885-15/e35/26065929_1705412746195325_928078334573674496_n.jpg,2018-01-05T09:05:02,9:05:02,42:55.2,photo,377254,,,,2,"Celebrating Chinese New Year, we announce the CNY Pack. Featuring the #NMD R2 and #EQT Support ADV, the pack arrives January 13th.","Celebrating Chinese New Year, we announce the CNY Pack. Featuring the #NMD R2 and #EQT Support ADV, the pack arrives January 13th.",,2,4,2,,,,,1,2,,,,,2,,,,,,,1,1,,"4,5,6",1,1,1,1,1,,"4,5,6,8",,3,,1,2,0,2,0,0,0,0,1,"Celebrating Chinese New Year, we announce the CNY Pack. Featuring the #NMD R2 and #EQT Support ADV, the pack arrives January 13th.",1,2
4,16,https://www.instagram.com/p/BdgJ7yEHeWw/?taken-by=adidasoriginals,https://scontent-icn1-1.cdninstagram.com/vp/3257720e3dac0bedf270aec81391f43b/5AEFDAFE/t51.2885-15/e35/26065567_1730249617027805_5304026787968188416_n.jpg,2018-01-03T21:29:11,21:29:11,42:59.7,photo,165737,,,,1,Make a statement with the first Consortium release of the year. @JUICE_HK’s #NMD Racer is available at Juice from January 13th and worldwide Consortium stores January 20th.,Make a statement with the first Consortium release of the year. @JUICE_HK’s #NMD Racer is available at Juice from January 13th and worldwide Consortium stores January 20th.,,2,4,1,1,2,2,"2,3,6,9",3,2,,,,,1,1,,2,1,1,6,1,1,,"2,5,6",3,2,1,1,1,,"2,3,4,5,6,8,9",,3,,1,1,0,1,0,0,0,0,1,Make a statement with the first Consortium release of the year. @JUICE_HK’s #NMD Racer is available at Juice from January 13th and worldwide Consortium stores January 20th.,1,2
4,17,https://www.instagram.com/p/BdfXXA7HYSb/?taken-by=adidasoriginals,https://scontent-icn1-1.cdninstagram.com/vp/40e1729012360b594c4bad67dfd7c2f5/5AF6C9B4/t51.2885-15/e35/25039132_1997022507207494_3177700123098480640_n.jpg,2018-01-03T14:07:15,14:07:15,43:01.5,photo,143159,,,,1,A bold shoe worthy of a bold pattern. The iconic Alienegra print throughout this release is a tribute to a city steeped in streetwear culture. This #NMD Racer arrives early at @JUICE_HK on January 13th and at worldwide Consortium stores January 20th.,A bold shoe worthy of a bold pattern. The iconic Alienegra print throughout this release is a tribute to a city steeped in streetwear culture. This #NMD Racer arrives early at @JUICE_HK on January 13th and at worldwide Consortium stores January 20th.,,2,4,1,1,2,2,"1,2,3,5,6,8,9",3,2,,,,,2,,,,,,,1,1,,"5,6,8,9",1,1,1,1,1,,"1,2,3,5,6,8,9",,4,,1,1,0,1,0,0,0,0,1,A bold shoe worthy of a bold pattern. The iconic Alienegra print throughout this release is a tribute to a city steeped in streetwear culture. This #NMD Racer arrives early at @JUICE_HK on January 13th and at worldwide Consortium stores January 20th.,1,2
4,18,https://www.instagram.com/p/Bde4aAanTv6/?taken-by=adidasoriginals,https://scontent-icn1-1.cdninstagram.com/vp/b6fe27452183e3c670c88a517b9a929e/5AE853D3/t51.2885-15/e35/25024972_134646990660989_3893799015338213376_n.jpg,2018-01-03T09:36:47,9:36:47,43:06.1,photo,192418,,,,1,Starting off the year with a bang. Hong Kong’s @JUICE_HK utilizes our latest silhouette the #NMD Racer for an unforgettable release. Available for pre-release at Juice January 13th and your local Consortium store January 20th.,Starting off the year with a bang. Hong Kong’s @JUICE_HK utilizes our latest silhouette the #NMD Racer for an unforgettable release. Available for pre-release at Juice January 13th and your local Consortium store January 20th.,,2,4,1,1,2,2,"1,2,4,5,7,8,9",3,2,,,,,2,,,,,,,1,2,,"5,8,9",1,1,1,1,1,,"1,2,4,5,7,8,9",,3,,1,1,0,1,0,0,0,0,1,Starting off the year with a bang. Hong Kong’s @JUICE_HK utilizes our latest silhouette the #NMD Racer for an unforgettable release. Available for pre-release at Juice January 13th and your local Consortium store January 20th.,1,2
4,19,https://www.instagram.com/p/BdYzuLqHX0w/?taken-by=adidasoriginals,https://scontent-icn1-1.cdninstagram.com/vp/247b03acd369c09d64a86680cb231152/5A615329/t51.2885-15/e15/25014070_203838276855454_1136115619700146176_n.jpg,2018-01-01T01:00:42,1:00:42,43:07.3,동영상,59230,,,,1,"747 Warehouse St. LA. February 16-17, 2018. Exclusive product, collabs and customization. Only available at the Warehouse. Tap the link in bio for tickets. #747WarehouseSt","747 Warehouse St. LA. February 16-17, 2018. Exclusive product, collabs and customization. Only available at the Warehouse. Tap the link in bio for tickets. #747WarehouseSt",,2,4,2,,,,,1,1,2,,"3,4,5,6",2,2,,,,,,,2,,,,,,,2,,,,,3,,1,1,0,0,1,0,0,0,1,"747 Warehouse St. LA. February 16-17, 2018. Exclusive product, collabs and customization. Only available at the Warehouse. Tap the link in bio for tickets. #747WarehouseSt",2,2
4,20,https://www.instagram.com/p/BdYaJQcH1Va/?taken-by=adidasoriginals,https://scontent-icn1-1.cdninstagram.com/vp/275e00de8a64d3fced02a48f61161750/5A616A1A/t51.2885-15/e15/25037958_138399073492357_5233290089647308800_n.jpg,2017-12-31T21:17:05,21:17:05,43:08.3,동영상,50716,,,,1,"747 Warehouse St. LA. February 16-17, 2018. A two day festival. A stacked line-up. Exclusive drops. Tap the link in bio for tickets. #747WarehouseSt","747 Warehouse St. LA. February 16-17, 2018. A two day festival. A stacked line-up. Exclusive drops. Tap the link in bio for tickets. #747WarehouseSt",,2,4,2,,,,,1,1,2,,"4,5,6",2,2,,,,,,,2,,,,,,,2,,,,,3,,1,1,0,0,1,0,0,0,1,"747 Warehouse St. LA. February 16-17, 2018. A two day festival. A stacked line-up. Exclusive drops. Tap the link in bio for tickets. #747WarehouseSt",2,2
4,21,https://www.instagram.com/p/BdYZ8i2H7f4/?taken-by=adidasoriginals,https://scontent-icn1-1.cdninstagram.com/vp/837f20c78cba45f0d246e4b5a9cac95b/5A61B5E7/t51.2885-15/e15/25039528_565916090468955_7089806251852300288_n.jpg,2017-12-31T21:15:38,21:15:38,43:10.3,동영상,47641,,,,1,"adidas & Co presents: ?747 Warehouse St. LA. February 16-17, 2018. Celebrating basketball culture. Keep your eyes open for more. #747WarehouseSt","adidas & Co presents: ?747 Warehouse St. LA. February 16-17, 2018. Celebrating basketball culture. Keep your eyes open for more. #747WarehouseSt",,2,4,2,,,,,1,1,1,,"4,5,6",2,2,,,,,,,2,,,,,,,2,,,,,3,,1,1,0,0,1,0,0,0,1,"adidas & Co presents: ?747 Warehouse St. LA. February 16-17, 2018. Celebrating basketball culture. Keep your eyes open for more. #747WarehouseSt",2,2
4,22,https://www.instagram.com/p/BdTW85NnoX6/?taken-by=adidasoriginals,https://scontent-icn1-1.cdninstagram.com/vp/df2c1a421a403cea78d0207eca16cda7/5AED22B1/t51.2885-15/e35/26067094_277861379409647_3300111574412296192_n.jpg,2017-12-29T22:12:48,22:12:48,43:11.8,photo,151614,,,,1,The #NMD Racer arrives with a unique streamlined silhouette and an aggressive racer aesthetic. Landing January 4th.,The #NMD Racer arrives with a unique streamlined silhouette and an aggressive racer aesthetic. Landing January 4th.,,2,4,2,,,,,1,2,,,,,2,,,,,,,2,,,,,,,1,2,,"1,2,3,4,5,6,7,8,9",,3,,1,1,0,1,0,0,0,0,1,The #NMD Racer arrives with a unique streamlined silhouette and an aggressive racer aesthetic. Landing January 4th.,1,2
4,23,https://www.instagram.com/p/BdTGEHYH1zp/?taken-by=adidasoriginals,https://scontent-icn1-1.cdninstagram.com/vp/1060d0f1a9be1e1230c0257933fdf778/5AEAE2BF/t51.2885-15/e35/25021733_135952993746284_710259102516772864_n.jpg,2017-12-29T19:45:14,19:45:14,43:13.1,photo,212042,,,,1,"NMD reaches new levels of innovation. Take to the streets with the #NMD Racer, January 4th.","NMD reaches new levels of innovation. Take to the streets with the #NMD Racer, January 4th.",,2,4,2,,,,,4,2,,,,,2,,,,,,,1,1,,"6,8",1,2,1,1,1,,"3,5,6,7,8,9",,6,,1,1,0,1,0,0,0,0,1,"NMD reaches new levels of innovation. Take to the streets with the #NMD Racer, January 4th.",1,2
4,24,https://www.instagram.com/p/BdSZowVnOhu/?taken-by=adidasoriginals,https://scontent-icn1-1.cdninstagram.com/vp/8465813eb414aac83f7b53e3d95cc572/5AFE16F3/t51.2885-15/e35/25022158_138328240180069_7875684159195185152_n.jpg,2017-12-29T13:17:01,13:17:01,43:18.5,photo,247408,,,,1,"The next generation of NMD, The #NMD Racer. Arriving January 4th.","The next generation of NMD, The #NMD Racer. Arriving January 4th.",,2,4,2,,,,,1,2,,,,,1,1,,"5,8",2,1,6,1,1,,"5,8",3,2,1,1,1,,"1,2,3,4,5,6,7,8,9",,1,,1,1,0,1,0,0,0,0,1,"The next generation of NMD, The #NMD Racer. Arriving January 4th.",1,2
4,25,https://www.instagram.com/p/BdQZXe3HpL6/?taken-by=adidasoriginals,https://scontent-icn1-1.cdninstagram.com/vp/d2609e4616f00c74ceee6fb10fb98804/5ADBE6CD/t51.2885-15/e35/25018962_254868685045693_2386108625056694272_n.jpg,2017-12-28T18:36:11,18:36:11,43:19.7,photo,174976,,,,1,"Created for urban adventurers. #NMD R1 with a premium Primeknit finish, arriving in stores January 4th.","Created for urban adventurers. #NMD R1 with a premium Primeknit finish, arriving in stores January 4th.",,2,4,1,1,1,1,"4,7",4,2,,,,,2,,,,,,,2,,,,,,,1,1,,"5,6",,6,,1,1,0,1,0,0,0,0,1,"Created for urban adventurers. #NMD R1 with a premium Primeknit finish, arriving in stores January 4th.",1,2
